{
  "schema_version": "2.0",
  "rule_id": "apple.xcode.ios-device-support",
  "version": "1.0.0",
  "status": "experimental",
  "platforms": [
    "macos"
  ],
  "category": "developer",
  "max_tier": "review_only",
  "rebuild_class": "local_rebuild",
  "owner": {
    "kind": "app",
    "id": "apple.xcode"
  },
  "root_resolver": "application_cache",
  "match": {
    "object_type": "directory",
    "relative_components": [
      "iOS DeviceSupport"
    ],
    "name_glob": "*",
    "extensions": [],
    "require_cachedir_tag": false,
    "archive_payload": false,
    "max_depth": 0
  },
  "exclude": [],
  "probes": [
    "owner_process",
    "open_file_handle"
  ],
  "thresholds": {
    "min_age_days": null,
    "age_basis": null,
    "min_size_bytes": null,
    "retention_days": null
  },
  "action_kind": "filesystem",
  "adapter_ref": null,
  "allowed_modes": [
    "trash",
    "quarantine"
  ],
  "requires_admin": false,
  "protect_descendants": true,
  "follow_links": false,
  "impact": {
    "summary": "Xcode iOS device support files: debug symbols copied from each connected iPhone/iPad OS version (~/Library/Developer/Xcode/iOS DeviceSupport/*).",
    "regeneration": "Xcode copies the symbols again the next time a device with that OS version is connected (several minutes; the device is needed).",
    "offline_effect": "Debugging on a device of that OS version waits for the symbols to be copied again. Archives, DerivedData and simulator devices are never matched."
  },
  "tested_registry_ref": null,
  "evidence_refs": []
}
