{
  "schema_version": "2.0",
  "rule_id": "netease.uu-remote.code-cache",
  "version": "1.0.0",
  "status": "enabled",
  "platforms": [
    "windows"
  ],
  "category": "app_caches",
  "max_tier": "review_only",
  "rebuild_class": "local_rebuild",
  "owner": {
    "kind": "app",
    "id": "netease.uu-remote"
  },
  "root_resolver": "application_cache",
  "match": {
    "object_type": "directory",
    "relative_components": [
      "Default",
      "Code Cache"
    ],
    "name_glob": null,
    "extensions": [],
    "require_cachedir_tag": false,
    "archive_payload": false,
    "max_depth": 0
  },
  "exclude": [],
  "probes": [
    "owner_process",
    "open_file_handle"
  ],
  "thresholds": {
    "min_age_days": null,
    "age_basis": null,
    "min_size_bytes": null,
    "retention_days": null
  },
  "action_kind": "filesystem",
  "adapter_ref": null,
  "allowed_modes": [
    "trash",
    "quarantine"
  ],
  "requires_admin": false,
  "protect_descendants": true,
  "follow_links": false,
  "impact": {
    "summary": "UU Remote (NetEase GameViewer) embedded WebView2 V8 code cache.",
    "regeneration": "Rebuilt when the UU Remote interface runs again; it may start slower once.",
    "offline_effect": "None expected: no device bindings, settings or login state are inside."
  },
  "tested_registry_ref": "netease.uu-remote.code-cache@1.0.0",
  "evidence_refs": [
    "run_win_catalog_netease_uu_remote_code_cache"
  ]
}
