{
  "schema_version": "2.0",
  "rule_id": "mozilla.firefox.cache2",
  "version": "1.0.0",
  "status": "experimental",
  "platforms": [
    "windows"
  ],
  "category": "browsers",
  "max_tier": "review_only",
  "rebuild_class": "network_redownload",
  "owner": {
    "kind": "app",
    "id": "mozilla.firefox"
  },
  "root_resolver": "browser_profile",
  "match": {
    "object_type": "directory",
    "relative_components": [
      "cache2"
    ],
    "name_glob": null,
    "extensions": [],
    "require_cachedir_tag": false,
    "archive_payload": false,
    "max_depth": 0
  },
  "exclude": [],
  "probes": [
    "owner_process",
    "open_file_handle"
  ],
  "thresholds": {
    "min_age_days": null,
    "age_basis": null,
    "min_size_bytes": null,
    "retention_days": null
  },
  "action_kind": "filesystem",
  "adapter_ref": null,
  "allowed_modes": [
    "trash",
    "quarantine"
  ],
  "requires_admin": false,
  "protect_descendants": true,
  "follow_links": false,
  "impact": {
    "summary": "Firefox HTTP cache (cache2) of one profile, kept under Local AppData apart from the roaming profile.",
    "regeneration": "Resources are downloaded again from the network when pages are next visited.",
    "offline_effect": "Cached-only pages cannot be shown offline until downloaded again."
  },
  "tested_registry_ref": null,
  "evidence_refs": [
    "run_win_catalog_mozilla_firefox_cache2"
  ]
}
