{
  "schema_version": "2.0",
  "rule_id": "bytedance.feishu.code-cache",
  "version": "1.0.0",
  "status": "experimental",
  "platforms": [
    "macos"
  ],
  "category": "app_caches",
  "max_tier": "review_only",
  "rebuild_class": "local_rebuild",
  "owner": {
    "kind": "app",
    "id": "bytedance.feishu"
  },
  "root_resolver": "application_cache",
  "match": {
    "object_type": "directory",
    "relative_components": [
      "CodeCache"
    ],
    "name_glob": null,
    "extensions": [],
    "require_cachedir_tag": false,
    "archive_payload": false,
    "max_depth": 0
  },
  "exclude": [],
  "probes": [
    "owner_process",
    "open_file_handle"
  ],
  "thresholds": {
    "min_age_days": null,
    "age_basis": null,
    "min_size_bytes": null,
    "retention_days": null
  },
  "action_kind": "filesystem",
  "adapter_ref": null,
  "allowed_modes": [
    "trash",
    "quarantine"
  ],
  "requires_admin": false,
  "protect_descendants": true,
  "follow_links": false,
  "impact": {
    "summary": "Feishu/Lark desktop V8 code cache (~/Library/Application Support/LarkShell/CodeCache).",
    "regeneration": "Rebuilt when Feishu/Lark runs again.",
    "offline_effect": "None expected: messages, databases and the sign-in state are not inside and are never matched."
  },
  "tested_registry_ref": null,
  "evidence_refs": []
}
